{
  "entries": [
    {
      "entity_id": "drink:228bf1cc-ffa2-5f6b-b6bf-5fa49b8277f7",
      "evidence_assertion_ids": [
        "assertion:13289d572862867f9ff2836927368c2f5db1500da5e437408035def937425603",
        "assertion:134e97ddf2307695d26347f934eae22b4b9827896e86a8818e7ec5f4e6d16a83",
        "assertion:25ec6abf998a870d6bad0714e52d16ec3332b78adcc55a681219a5bd7c347966",
        "assertion:2f68f0f8c444bf0bfd3ccf78388075f4a6ff8b6c553c69979a6efe9cd8111d14",
        "assertion:380d6de20b634b7187c100a5bd7e5b0943168a84db9928c94f042d93d75ccc64",
        "assertion:391ad457699b34b19c881c7bc61027f9a6ed12b0635c12c37e4dd833c9261949",
        "assertion:3e5f23861be699265889b8cc7100a3427b5ef6eb2a3309a2dbbe3f30a97f1f34",
        "assertion:3f1303a6146ef4f30e1bfd8564f375ef52c958dfd4f7bb931fc35325c766af73"
      ],
      "runtime_support": "display_only",
      "scenario_available": true
    },
    {
      "entity_id": "drink:bfb2b852-6782-554d-9a32-f3794109ca46",
      "evidence_assertion_ids": [
        "assertion:1f0c532787cfa51340dc43b711e95d3bd7d6382b17291974e478bf01b097c231",
        "assertion:25724f5f3d9e4552fd20578621699c05e7d5a11cd93cabc0cc7a9a73c0a8f65f",
        "assertion:4101ffd45737a83367a06f71992f83482a0a26b4364023873a5226a968977bd0",
        "assertion:45d36f0fd617d2cad28eab3784ac0fb96854a26471991cb8b234cbbd457ec84c",
        "assertion:4e1d66cbb2f873bf31a4a5a0164973d8ce6c472252bf8c4abaf41b17b64f131f",
        "assertion:58c405440509d993d06b5a7b7498bc087bbe0c1da8f938399d3d4f4d989af7ef",
        "assertion:7808a64497304403392006f604acf95fcf8d3b9566932b0cc256a2e9fb599de2",
        "assertion:795967c02cf2d93106e65f71199293577dba4bacf9173fa57f88fcfe1870c98a"
      ],
      "runtime_support": "display_only",
      "scenario_available": true
    },
    {
      "entity_id": "drink:d49e4fe2-7da5-5b19-bc8f-ee186338dc2a",
      "evidence_assertion_ids": [
        "assertion:094e0ccaf8d745ff96c44c80cec850adc1e0556932a110fc4a591121488b9e9c",
        "assertion:140e1da979edd3ad8713144a7d0b1eef81812a71d6fa95493a06a17d5c4b1335",
        "assertion:1da6bbf72e96106f8c299ea934e0e968c27116b10b9ba0efbe428f36c721f2a1",
        "assertion:226ed6e63b1a44befeea0a18dd16b7e12fe811837ba83097674fa3d92d92294b",
        "assertion:2fecdb84694159550dc9c361b7c8c261b819de7e3d38af1523d232d70ba69772",
        "assertion:39996a5187b28b9c3f11260303ba0a6fd26ba727b54a8ad292e820fc95876487",
        "assertion:4b2015df3b59ef251d116921679840e48f315a54be63ba58651a9ad6fd008149",
        "assertion:593014db18db3ee93c04c9a61f351c1529fc0748b4d24d1a2e035657abfcd890"
      ],
      "runtime_support": "display_only",
      "scenario_available": true
    },
    {
      "entity_id": "drink:13608b36-85a8-50c0-95b5-b58619bf6e48",
      "evidence_assertion_ids": [
        "assertion:0afca5d6ca0cdcc821517caed9688ab0e24784f6a6208d8b423d329c5334147f",
        "assertion:165e459035908e878d6955f4645f2381b2aa81930b7177b3848258777bad4f3e",
        "assertion:16af38222e2dcc068b1e5dd198e6947e24eb07b2e5d8057e4bedfd0f71d8517c",
        "assertion:34289217690234aa6911bc3311d3e1bad83af69fefda60b2a958a870bc638c0d",
        "assertion:39aa7dad24a9ee7474096251b6912324d61c1f0c4180392a4bbcd5087be1d15b",
        "assertion:3ee5c3df1b0be35b80e83521c11ed662c6ad30c6567cfa2f55b4541f0e86b0bf",
        "assertion:41d963a00f8446d29f2fdbaddf963595f8eb21781d2e035a7a1ca09484f17f33",
        "assertion:4bcb6c0adb13ac729be84f3491271223e40c7aa78749981a0627cf48ae01b3b5"
      ],
      "runtime_support": "display_only",
      "scenario_available": true
    },
    {
      "entity_id": "drink:a0157b4e-03a4-5c38-ad74-e141b7698ccc",
      "evidence_assertion_ids": [
        "assertion:1bf62ed5083e7b41179acca751e64c87ebdf956200991c74e629f187e3c8f1e7",
        "assertion:3cfb6d38d78e512d51a86924cf33afec1f1845a0bf4ca73e72c86df9bbea4e8b",
        "assertion:3f46839bddfb4e0662950794def63eb0f525b209a1a06b52be8a1ad8c5ae50fb",
        "assertion:418c1bdfa48370522b32954f3f64014ba6874474a29c9d0849452d844c190598",
        "assertion:5145eb3c2ba0e50d14c19bc1de3c3130bc428bfa3c2f85f346271f499dc6036f",
        "assertion:6077a5ab30af03cc28d56978428b34ec7234fa19f727536ef9678402549fdb78",
        "assertion:76a42c12aec556a7709f921bf734f6859315b768a53eedf5be2c9c9dcf0633ea",
        "assertion:9461117ebf1f3464ab5dc670210026a47fbe9855724f460f4e1d8c4c8c6e2af3"
      ],
      "runtime_support": "display_only",
      "scenario_available": true
    },
    {
      "entity_id": "drink:358cd693-e84f-5d37-92e6-ee9f7ed8b969",
      "evidence_assertion_ids": [
        "assertion:030e0e22768a0f995be070757ba4f2bd2df17e01357e09794ebaade8fb785b4a",
        "assertion:03819c022d2e41372f04365d2371aaa46bffb4bd85af0e95f153aab3b81807d3",
        "assertion:05a8c3c999cd2f5d5f58f6ae3eb559173940de60e9108dd3afb4854ceda692d4",
        "assertion:071ff044b5f4dc422d692efb02125ecb746e4ed52f087069420debab4f25fa09",
        "assertion:0ed5a38a4cd4b0c1f1ffafe92bce80a0d8dfb11209b89069540f34450be26be3",
        "assertion:19b6d7c407a96e873488292b24bf8a073c4072ca44bef2357544e7e3efbf79c5",
        "assertion:1e9a54552e95a5000d86bf6f1be556991079e057f90ee70add27816c41320f57",
        "assertion:22219d26abe3e0377fd420c27a6d8e2c2999cd0db4617f5087b9ca4d630d610f"
      ],
      "runtime_support": "display_only",
      "scenario_available": true
    },
    {
      "entity_id": "drink:1ef6372c-6107-5669-b285-be9bc40d512b",
      "evidence_assertion_ids": [
        "assertion:12bae1a7e93a88e7c2d08161079e11930984aa8e954356a0ff164d1eb2f99824",
        "assertion:17c9277dad76b6299576a9a2b80ddf58d57578a9e49ce38dae6eca45869bbefa",
        "assertion:3886cc8b77c42369ac6c41807afc01a6071632f0a7e7a4198cf9092df74354dc",
        "assertion:42d3927a51bc2d8ed8c301282c29a981e15a441f0fec42c04ef9606dd45e4c30",
        "assertion:523eb6b136086a69ca689aa028798ada4f04cc85849ebefd90e0f7635675dcf2",
        "assertion:7f48ad12e4245853d2cf28cb4029e711d0d84239bb19e10804dac3eec64e4a59",
        "assertion:8b3aad92935569285eee36f2462d0b467b20a8db1d89989785cccb4a71b60c91",
        "assertion:8dc5e1942aefd1f7b333ae362e704971e3a6cdd0643a0c6562d30337925bda7d"
      ],
      "runtime_support": "modeled",
      "scenario_available": true
    },
    {
      "entity_id": "drink:56e7041a-a452-58d7-8d47-a161dcc41392",
      "evidence_assertion_ids": [
        "assertion:3711bc18461cf5f99887c001ab1809615baa869717c199f018e640ec8de1ab79",
        "assertion:3b8dcbfc78b4ea891e8e5c26dd028fd62fc1d94258f21e934c618d46348ddc20",
        "assertion:3d887ba71d60d7e6d6b6123c02ce7371981a684741863b3656cdb564f2843fa6",
        "assertion:4eac7b0aebade9a242a90b7ad3ca01b88d23d4d779f939424dc2a61b02a50825",
        "assertion:5f72b4ac1b597054903eeecf4f69417d3034e6fc0d71f8b78fd7810135bbcb79",
        "assertion:60d226ead2d18de86b0d7e55f36788303a2f420aaef1817a9c9e36ab25b6e198",
        "assertion:7084909bb41ea8988e454ceb74044cdf34658d5dcb1fee522838daaca30a040a",
        "assertion:7a09fe1e38716dcd89874aea8d6a98a698f428e27979b7d77910af5ded3bc25f"
      ],
      "runtime_support": "modeled",
      "scenario_available": true
    },
    {
      "entity_id": "drink:0d3d225a-ff77-599b-9be1-0ae2e4887fd4",
      "evidence_assertion_ids": [
        "assertion:0be868e64cab027a6ccda5a678e2c619612171811446d69b47574f38dcf22d2a",
        "assertion:1020da0eaa663f2efb1fab7814f6a6170c9396e0a464ea5a3bd7627f351e17d3",
        "assertion:137649beaa3f25a6bcdab487011b0bde845bfbca1b0fb7f3bf49b47665c7682f",
        "assertion:2535c65109ef915b6642650efad29005fa3f2c73cd04139ec326585a8e667ede",
        "assertion:2559c6ce51be129ddc6798a07a4b86e2eaa3106bffa585414393fa1ec130eda5",
        "assertion:2b1463cae19874bff18dd2c892af000d187455fd3a8143268784b6250a87ddeb",
        "assertion:3e737df425bae95cb3d4417081580e025baa88a3259590557068a6f2922b6fe9",
        "assertion:465dc15eb360320d674f7181965256f967d45680aed51fed88066271c8bcc2af"
      ],
      "runtime_support": "display_only",
      "scenario_available": true
    },
    {
      "entity_id": "drink:1d1ba33c-1d77-52e2-9a26-b4121212555e",
      "evidence_assertion_ids": [
        "assertion:0c536d52a3c840d11c8d48cfd89bacd65516f7b289ad52e38916fad729ed0f44",
        "assertion:11e1fd5a68b229de7c0488f8947dcb0522df98fe9e9aef2032e4d46dbf3d4bb1",
        "assertion:47377dae6d686c7cf390801ef269b07816dacceac0c342d996f70a4ddd4d1da3",
        "assertion:593914f53d853b391af5d09779e2c9f29cbd128ecc0928301390aaed58819641",
        "assertion:59e43b79ed7342b9638c1481d9af01f8a4781ad70d9f868288afa8b294a0bdbb",
        "assertion:611b066bc49b41a32724a0d56ef3aacb69deb559f0b0dd8353531d5a3c237466",
        "assertion:6bf58a427a16afb11236507e18e8c7f840eb57f58a9bdcace23ade64837cd7d8",
        "assertion:738fea22a6c3087167a0bf312e1118c26858ec698337ca9cafb3ae078db05e1f"
      ],
      "runtime_support": "display_only",
      "scenario_available": true
    },
    {
      "entity_id": "drink:12bacb46-7494-5d83-96f2-43672e075da8",
      "evidence_assertion_ids": [
        "assertion:06fbc65e26d6333a8149cf66cc9aec3f206eb2a7be272e35b479c35be9c55b52",
        "assertion:0d3ec13b407388ca3b1445f05994c06feb3591db23e36d2a08253ed514256595",
        "assertion:0dc6424f9ff9eec8d8212c80d978501bdeceea6d16d59a8fe656fea5f0ea9b3d",
        "assertion:250e6d7f07e9f2c033b44c48d9134069736ba9b3475561bd50f4f2a992dbdb5b",
        "assertion:598c0509ce537be708afd7f1510989a90a380cfa973a4e335a021834155c958a",
        "assertion:7171ac3f9c392771d822917c71c25c93a77de1d17425415c2eb93780f79a07fa",
        "assertion:7535c82984ffb4dcd040e657b20edf69da1c63804db9cfadb734f7689bbd35d7",
        "assertion:7c357731b7b53b77ac1c60a1e53652ef3819d0f137ff3605dfcc7805f99cc97e"
      ],
      "runtime_support": "display_only",
      "scenario_available": true
    },
    {
      "entity_id": "drink:1a89aad5-f6c7-589c-9119-ed3b6ceb27d0",
      "evidence_assertion_ids": [
        "assertion:00dd19c7d9e19beb6ac3e468bd747d90f5ef57360b4411cf2acea19db65f804c",
        "assertion:11c67812916456156f6a8bf8882fb54ad141407d712cd239bd890e0a42b1e471",